{
  "task_id": "relu_bias",
  "task_type": "elementwise_fusion",
  "difficulty": "L1",
  "description": "Apply learnable bias then ReLU.",
  "input_shapes": [[16, 64]],
  "dtype_constraints": ["float32"],
  "device_constraints": ["cpu", "cuda"],
  "correctness_tolerance": {"atol": 1e-4, "rtol": 1e-4},
  "baseline_targets": {"eager": "pass", "torch_compile": "pass"},
  "editable_files": ["model_new.py", "kernels/"],
  "timeout_limits": {"compile_sec": 120, "verify_sec": 120, "profile_sec": 180}
}
